0	0.05004	heart make wind bird fair rose single delight spare proud break ear arctic heavenly lady stops base invisible noise lone 
1	0.04978	purple east west day mountain eye mystery solemn rest amber days parting sunset north south evening faithful lets renown alike 
2	0.04112	joy wild men tight push born gate gown advance shut mind sown bog despise vaster bough visited burdock's tent prognostic's 
3	0.04665	door lost shut pray left dont tim passing ajar cup father curious instant chamber walk journey point slowly sleeping paradise 
4	0.04441	music blossoms bubble career summer's bird shorter hum hand miles robins lie dew morning heaven tare sister tomorrow tune year's 
5	0.05661	grace sweet heaven face deity show love transport shone foreign beauty truth change names sigh clear place remember lack chose 
6	0.05049	looked jesus size guess dying failed true room nought ample eyes lightly eternity infinite trust wert fading men narrow arm 
7	0.04794	day wear touch crown thing royal heard snow degree king gold god afraid rank fear hold small life woman sigh 
8	0.0466	grass death pass thought face sovreign affliction solitude stay sod dropped suddenly trade inferred bell street loaded presence possibility broke 
9	0.06535	death love life live die grave immortality died lived show alive faith hell prove breath dost date doubt calvary remaining 
10	0.04947	soul spirit flesh make unknown grown cease arm leads touch giant power future arrow adamant identity estranged partook sickness condemned 
11	0.04815	sea heart brook feet blue brooks river made scene seas wells adjust dry startled breaks acres signal wearing beloved grow 
12	0.04413	fingers touched home glass passed road hungry held felt left wood curious windows words stir hand fled fluttered superior satin 
13	0.04331	home day wings church long heaven boy sings hope sabbath god prison wear bobolink suppose play dome bell lot orchard 
14	0.0438	time victory joy defeat bells drums glad calvary positive result faith disdain wished slain conclusion presuming obtained prospective penurious fear 
15	0.04247	makes side hands katie smile road reaches absent lands remained accompany bear meet amethyst safe knee boughs fortune disappeared hint 
16	0.05506	heart forgot blame poor hand late forget notice rich remembered knew hoped harm face touch borne luxury pace suffered sleep 
17	0.05135	nature human awe nature's lightning laid pink hue fire furthest summer exists shining drawer citizen sun volcano glove dropt conscious 
18	0.04925	things put grace death buy death's choose man life's fond life action breathed gifts people opportunity violet latitudes unique circumstances 
19	0.0427	news face knew thing paradise feel love trust laid reportless diviner appalls peter docile hints constancy caspian fight sweeter domingo 
20	0.0457	realm distance hair block retrospect food faces taste reprieve suppose shook fate stimulus clothes penury realms vail years time's beloved 
21	0.048	flower bride bring make hide flowers gay tune bee maid hair softly hundred merry dower drunken bright thine liquor bestow 
22	0.04432	foot day shore reason vitality revolution nearest appalling pod cheek endure die angels hast overcome league emperor april route mansion 
23	0.04366	hand sir grand sleep friend deep land houses understand people eternity supposed brave cry stone chosen green vanished century skip 
24	0.04384	seed truth infinite nature equal triumph steady exist good palm kinsmen longing invited supreme shun preferred significance plated bloom iniquity 
25	0.04758	heart art vast company nay immortality accent visit dwell hill ascend ride fuzz rapture chamber instinct society bells hundred black 
26	0.04628	hands abroad simple hand dust birds full leaves waters common sunshine hold cattle flung bow glee put showed drop tree 
27	0.04644	sea son god father miracle firmament plank tonight built told tale hath storm mansions faith west shunned bridge crowd sails 
28	0.06692	day night morning morn sunrise noon sun dawn place birds sunset east midnight men sleep summer's home tired wake slow 
29	0.04937	lost bore ring soul small loved home voice flower people grave satin held head born garden found sow guess riddle 
30	0.04169	faith speech word laurel feet stately needle tree everlasting lay fell behold air bond vail fail unknown faces troth spurn 
31	0.04547	lord stranger lift dare stand asked purple hide wait live test hat host deny curiosity witness round shy sweetest alms 
32	0.05471	stop hour long centuries slow count short foot ago show pain cross end larger bed grow hang stem wait size 
33	0.046	robin nest rest early thine father bold secret town death history bird pencil punctual hand native fold tenderly playmates industrious 
34	0.04099	boys morning girls men territory means lover miles lonesome afternoon bethlehem docile subjects flood raised experiment dawn sighing revelation savior 
35	0.0538	good night sight put heart turn weary bye part side passed joy head singing pleasure brain tomorrow martial run fire 
36	0.04352	bird knowing dying open birds feathers return door light long suspense strong home hurts found angel delight crumb abyss reluctant 
37	0.04522	thing man today immortality fame honor power death yesterday gathered superfluous equally sight fact instant delight sorrow discern extatic leaning 
38	0.04816	fly lie die sky light low window seek barn child flake queen spotted face butterfly chastened day chivalry peculiar affection 
39	0.04816	hill rose sun care feet head awkward low immortal grew chimney deeper gay pretty drew pane cheek busy felt twilight 
40	0.04553	day gold riches deem poverty broad gem pearl power prove queen wealth estate taught fingers play india scarce exists stint 
41	0.04826	god round sky pass back heaven superior cloud hid ourself turned brain possibly finished slowly pound subject triumph clouds conviction 
42	0.0456	act finer escape thing departure minor made scarcely chance common dower fill privilege news world poet presents circumstance spoke report 
43	0.04792	die sweet dying recollect day easy full general breaking forgetting answered nature wolfe murmur comprehend recollecting drama permission fainter rendered 
44	0.04839	slow day read eyes letter left hear finished happy strove fingers knock learned final stars sentence guessed begun seam consciousness 
45	0.04371	heaven hour stir thought borne belief parties demand blush cocoon heavenly start pit portentous nods rooms suspect centuries idleness sit 
46	0.04877	sky sudden yellow hills winds plain evening room makes blue purple road worm guest rain decay begun diamonds gray sweep 
47	0.05049	gain loss content amber price earn worth despair sacrament desert wilderness heaven grace perish delight holiday pay fraction feels smallest 
48	0.04381	mighty wind nights years blaze noon feel sky long noons thousand stands thunder put pile side pain childhood's shown tunes 
49	0.05148	sea feet stand land night snow winter children neighbor fair peace sand bells storm sun heard play hill great story 
50	0.04533	pain stone bone creature hight wait infinite ache conjecture moved recognition withdrawn lily sing step lead apparition utter decade glittering 
51	0.04941	light dark house held force town holds return lamp dare arms glow made wick wait easy neighbor lay eye faint 
52	0.05171	friend place eye lie word star suns life set accustomed secrets dust turns darkness stimulate vital august daily fitted interrupt 
53	0.05099	bee flower butterfly afternoon nature's single made clover bumble beneath bees grass eye honey june hills sign eden defrauded show 
54	0.0528	men today dead children times thing dont precisely work met died smile year intimate fields wiser opposite women film paid 
55	0.04874	spirit man flee countenance human god book inn entertain distant enacted space boldly pity pleased frugal wise residence accost stopped 
56	0.04732	moment feet twill mortal nought period freight twould remembering cease remembrance weight put cedar weigh single drove soil universe reduce 
57	0.04754	past half silver single circumference fear rest place privilege melody manner reversed choose experiment company leagues intimate lamps test term 
58	0.0453	man art grave summer easy praise diadem unconscious put head morning high hath beautiful crown silver perished ducal save nameless 
59	0.0449	dead meet find care living tree figure saved sigh squirrels divine meat perdition equally gently kernel precious awake send constancy 
60	0.05102	love sweet miss fit time suit great parting build bright vain enamored dull ether judge flight wherefore grown close event 
61	0.05013	find mind eye stars instant doubt wake fear thyself asleep forehead wreck prevail missing elate abode waiting absence difference forge 
62	0.04854	rose bee bird dew breeze meadow fingers majesty plain play plush syllables velvet rare bobolink chase write sword step run 
63	0.04503	air nature heavens silence universe window set time streets stood covert awe street feel ball eclipse strike search slay boldest 
64	0.04887	life moon face star solemn subtle full climb night sake withdrew glow suffice light hast infinity memory glory morning's guest 
65	0.04376	bliss stood secret life gold told sudden gained decide breath science guard low buried pushed honest prize lip shrewd sail 
66	0.04837	dear march birds close coming blue house bold makes april minds jay line faces die year dog forests sky purple 
67	0.04713	spring white balm grave dead green color summer left fling outer sing closed secret bright dying diviner distant shuts rhine 
68	0.04315	deem quiet forces ran clock consciousness patience syllable misery mutual ceased skill gave hearts broke dissolved costly climbing pendulum genesis 
69	0.04826	knew anguish die told eden god unknown live fair dishonor learn full stooped mortality sake played option ashamed forfeit made 
70	0.05102	time surprise eyes dream home prove power perfect paradise circuit narrow scant features venture believes esteemed wide garment swift walls 
71	0.04285	nerve red anguish creatures breath cool steel blood hurt granite death extasy speech freight fall cunning adieu playing glad tears 
72	0.04198	peace make skies golden thought tree fine robin hills earth frequently tradition woods breast picture thoughts axis behold orchards wonderful 
73	0.04371	ear hear thought sound quick grief surmise common teach book springs smaller murmuring lower school thread everlasting shows skill forget 
74	0.04123	beggar crumb table berry lady suffice men lips famine risk suspect nature's holds figure gave plea tun dies dine charity 
75	0.04856	time soul heard things eternity world ear eye brain breath sense side ages horror slow gave led awful seal lost 
76	0.04597	soft sir fire village hill woods daisy everlasting strong purple mountains daffodil gathered stirs steal fit opal aster bonnet found 
77	0.04842	house water called soul run body drink great thirst adequate moses rejoice soft mountains speak knew erect note presence man 
78	0.05662	sun lives make sound world show bound mighty afraid stars sufficient instant's trouble contented limit feeling fall hem clutch needless 
79	0.05343	life face put give cold warm work paradise call frost soul eyes cool blow difficult vitality forget forgive crease stopped 
80	0.05491	summer noon sun flowers bees butterflies bloom tune june lies setting dew bright tint south frost garden daisies roses spices 
81	0.04923	days summer air child bee mistake wine back year uncertain partake show thine months sacred cheer altered haze permit sacrament 
82	0.04533	shame forever boy man tree brave sky hat apple country charge dreams girl surpasses robins modest rise true enticed nations 
83	0.05462	eyes long air liberty prayer drop sight bore bear patient round rise follow eye shape gaze content lips yesterday give 
84	0.04941	knew years felt dropped met told glory dominion doubt spurn today pain ultimate big ways experience delight behold triumphant groped 
85	0.0518	heaven earth small place judgment true solid reach quiet large world utmost doubtless goal saints life's atom lie hopeless centre 
86	0.04557	hope dust remain skies stay fair delight trust wheel blossom friends case extent lies adjusts homesick journey route saints compound 
87	0.05826	god friend eternity paradise face existence time today visitor interview fear guest courtesy forbid creation seasons hand due remember treason 
88	0.04393	day small witchcraft play memory acre mankind mention unknown design destiny eternally room part wrinkled early mountain hung thinking thanksgiving 
89	0.04434	low wont met snow smiling sweet angels begins timid barefoot simple hands ermine service stooping early paused started lead kiss 
90	0.04798	wind nature summer melody voice trees bird sea winter cricket squirrel march heard birds laid floods competing blew note elegy 
91	0.05418	sun day earth time thought feel home place passed makes year ghost nearer step passing yellow house fog helped died 
92	0.04776	perish grave fate doom time bold chance loneliness man lose leaves fail universe pause hath awful pillow numb fundamental begin 
93	0.04102	sun drop flower death sea frost begun easy life woe hated held envy scarlet beauty larger fought pane helpless crawl 
94	0.04589	soul divine present possession moments bear won danger shows stop society bliss fair majority convenient frightened dazzled spider perfidy evidence 
95	0.04485	world bird vain celestial grows gains twig empty back fence lifted sang sweeter plain universe hymn train rode bore face 
96	0.04214	mind alive balls conscious sting face life sea floor fan gown warm estate lean soul sun tie bread breathing mighty 
97	0.044	ground fine found begin reverse feels sounds descend fetch abide root achieved befall prosperity effort leave dwelleth prudent gale repeal 
98	0.04685	back tomb pearl gown softly years wore town worn white grief quaint justified word light fashions earl familiar smile road 
99	0.0477	door leave dwell care fellow ecstasy business fear men despair house glory pursued odors hay floor thief ear spring talk 
